,appid,name,short_description,developer,publisher,genre,tags,type,categories,owners,positive,negative,price,initialprice,discount,ccu,languages,platforms,release_date,required_age,website,header_image,rating
56,239140,Dying Light,"First-person action survival game set in a post-apocalyptic open world overrun by flesh-hungry zombies. Roam a city devastated by a mysterious virus epidemic. Scavenge for supplies, craft weapons, and face hordes of the infected.",Techland,Techland,"Action, RPG","Zombies, Survival Horror, Horror, Online Co-Op",game,"['Multi-player', 'Single-player', 'Valve Anti-Cheat enabled', 'Co-op', 'Includes level editor', 'Steam Achievements', 'Steam Cloud', 'Full controller support', 'Steam Trading Cards', 'Steam Workshop', 'Online PvP', 'Online Co-op', 'Remote Play on Tablet', 'Remote Play on TV', 'PvP']","5,000,000 .. 10,000,000",329253,17179,899,2999,70,21327,"English, French, Italian, German, Spanish - Spain, Dutch, Polish, Portuguese - Brazil, Russian, Korean, Simplified Chinese, Spanish - Latin America, Japanese, Thai, Traditional Chinese, Turkish, Czech","{'windows': True, 'mac': True, 'linux': True}",2015/01/26,18,https://dyinglightgame.com/?utm_source=Steam&amp;utm_medium=Link&amp;utm_campaign=Dying_Light,https://cdn.akamai.steamstatic.com/steam/apps/239140/header.jpg?t=1666707597,0.5934782608695653
57,240,Counter-Strike: Source,Counter-Strike: Source blends Counter-Strike's award-winning teamplay action with the advanced technology of Source™ technology.,Valve,Valve,Action,"Shooter, Action, FPS, Multiplayer",game,"['Multi-player', 'Valve Anti-Cheat enabled', 'Stats', 'Includes Source SDK', 'Steam Achievements', 'Steam Cloud', 'Cross-Platform Multiplayer']","10,000,000 .. 20,000,000",137721,5458,999,999,0,5058,"English, French, German, Italian, Japanese, Korean, Spanish - Spain, Russian, Simplified Chinese, Traditional Chinese, Thai, Turkish","{'windows': True, 'mac': True, 'linux': True}",2004/11/1,0,,https://cdn.akamai.steamstatic.com/steam/apps/240/header.jpg?t=1666823740,1.0693181818181818
58,242050,Assassin’s Creed IV Black Flag,"The year is 1715. Pirates rule the Caribbean and have established their own lawless Republic where corruption, greediness and cruelty are commonplace.Among these outlaws is a brash young captain named Edward Kenway.",Ubisoft Montreal,Ubisoft,"Action, Adventure","Pirates, Open World, Assassin, Action",game,"['Multi-player', 'Single-player', 'In-App Purchases']","2,000,000 .. 5,000,000",48077,5548,3999,3999,0,741,"English, French, Italian, German, Spanish - Spain, Czech, Danish, Dutch, Finnish, Norwegian, Polish, Portuguese - Portugal, Portuguese - Brazil, Russian, Swedish, Simplified Chinese","{'windows': True, 'mac': False, 'linux': False}",,0,http://www.assassinscreed.com,https://cdn.akamai.steamstatic.com/steam/apps/242050/header.jpg?t=1616174462,0.6
59,242760,The Forest,"As the lone survivor of a passenger jet crash, you find yourself in a mysterious forest battling to stay alive against a society of cannibalistic mutants. Build, explore, survive in this terrifying first person survival horror simulator.",Endnight Games Ltd,Endnight Games Ltd,"Action, Adventure, Indie, Simulation","Open World Survival Craft, Survival, Open World, Horror",game,"['Multi-player', 'Single-player', 'Co-op', 'Partial Controller Support', 'Steam Cloud', 'Online Co-op', 'LAN Co-op']","10,000,000 .. 20,000,000",394258,19678,1999,1999,0,24329,"English, French, German, Czech, Finnish, Japanese, Korean, Polish, Portuguese - Brazil, Russian, Simplified Chinese, Swedish, Traditional Chinese, Turkish, Italian, Spanish - Spain","{'windows': True, 'mac': False, 'linux': False}",2018/04/30,18,http://survivetheforest.com/,https://cdn.akamai.steamstatic.com/steam/apps/242760/header.jpg?t=1666811027,0.7476190476190476
60,244210,Assetto Corsa,"Assetto Corsa v1.16 introduces the new &quot;Laguna Seca&quot; laser-scanned track, 7 new cars among which the eagerly awaited Alfa Romeo Giulia Quadrifoglio! Check the changelog for further info!",Kunos Simulazioni,Kunos Simulazioni,"Indie, Racing, Simulation, Sports","Racing, Automobile Sim, Simulation, Driving",game,"['Multi-player', 'Single-player', 'Includes level editor', 'Partial Controller Support', 'Steam Achievements', 'Steam Leaderboards', 'Online PvP', 'PvP']","2,000,000 .. 5,000,000",71157,6158,1999,1999,0,9035,"English, Italian, Simplified Chinese, Traditional Chinese","{'windows': True, 'mac': False, 'linux': False}",2014/12/19,0,http://www.assettocorsa.net,https://cdn.akamai.steamstatic.com/steam/apps/244210/header.jpg?t=1651677274,0.768181818181818
61,250900,The Binding of Isaac: Rebirth,"The Binding of Isaac: Rebirth is a randomly generated action RPG shooter with heavy Rogue-like elements. Following Isaac on his journey players will find bizarre treasures that change Isaac’s form giving him super human abilities and enabling him to fight off droves of mysterious creatures, discover secrets and fight his way to safety.","Nicalis, Inc., Edmund McMillen","Nicalis, Inc.",Action,"Action Roguelike, Rogue-like, Indie, Replay Value",game,"['Multi-player', 'Single-player', 'Steam Achievements', 'Steam Cloud', 'Shared/Split Screen', 'Full controller support', 'Steam Trading Cards', 'Remote Play on TV', 'Remote Play Together']","5,000,000 .. 10,000,000",210521,4995,1499,1499,0,17629,English,"{'windows': True, 'mac': True, 'linux': True}",2014/11/4,15,http://www.bindingofisaac.com,https://cdn.akamai.steamstatic.com/steam/apps/250900/header.jpg?t=1617174663,1.1928571428571428
62,251570,7 Days to Die,"7 Days to Die is an open-world game that is a unique combination of first-person shooter, survival horror, tower defense, and role-playing games. Play the definitive zombie survival sandbox RPG that came first. Navezgane awaits!",The Fun Pimps,The Fun Pimps Entertainment LLC,"Action, Adventure, Indie, RPG, Simulation, Strategy, Early Access","Survival, Zombies, Voxel, Open World",game,"['Multi-player', 'Single-player', 'Co-op', 'Includes level editor', 'Steam Achievements', 'Cross-Platform Multiplayer', 'Full controller support', 'Steam Trading Cards', 'Online PvP', 'Online Co-op', 'Remote Play on Tablet', 'Remote Play on TV', 'LAN PvP', 'LAN Co-op', 'PvP']","10,000,000 .. 20,000,000",207039,27355,2499,2499,0,36102,"English, French, German, Spanish - Spain, Italian, Japanese, Korean, Polish, Portuguese - Brazil, Russian, Simplified Chinese, Spanish - Latin America, Traditional Chinese, Turkish","{'windows': True, 'mac': True, 'linux': True}",2013/12/13,0,http://www.7daystodie.com,https://cdn.akamai.steamstatic.com/steam/apps/251570/header.jpg?t=1650477344,0.8888888888888887
63,252490,Rust,"The only aim in Rust is to survive. Everything wants you to die - the island’s wildlife and other inhabitants, the environment, other survivors. Do whatever it takes to last another night.",Facepunch Studios,Facepunch Studios,"Action, Adventure, Indie, Massively Multiplayer, RPG","Survival, Crafting, Multiplayer, Open World",game,"['Multi-player', 'Valve Anti-Cheat enabled', 'Co-op', 'Stats', 'MMO', 'Steam Achievements', 'Cross-Platform Multiplayer', 'Steam Trading Cards', 'Steam Workshop', 'In-App Purchases', 'Online PvP', 'Online Co-op', 'Remote Play on Tablet', 'PvP']","20,000,000 .. 50,000,000",732513,112154,3999,3999,0,121146,"English, French, Italian, German, Spanish - Spain, Japanese, Korean, Russian, Simplified Chinese, Ukrainian, Polish, Portuguese - Portugal, Turkish, Arabic, Czech, Danish, Dutch, Finnish, Greek, Norwegian, Portuguese - Brazil, Spanish - Latin America, Swedish, Traditional Chinese, Vietnamese","{'windows': True, 'mac': True, 'linux': False}",2018/02/8,17,http://rust.facepunch.com/,https://cdn.akamai.steamstatic.com/steam/apps/252490/header.jpg?t=1666865208,1.4244680851063825
64,252950,Rocket League,"Rocket League is a high-powered hybrid of arcade-style soccer and vehicular mayhem with easy-to-understand controls and fluid, physics-driven competition. Rocket League includes casual and competitive Online Matches, a fully-featured offline Season Mode, special “Mutators” that let you change the rules entirely, hockey and...",Psyonix LLC,Psyonix LLC,"Action, Indie, Racing, Sports","Multiplayer, Soccer, Competitive, Sports",game,"['Multi-player', 'Single-player', 'Co-op', 'Stats', 'Steam Achievements', 'Steam Cloud', 'Shared/Split Screen', 'Cross-Platform Multiplayer', 'Full controller support', 'Steam Trading Cards', 'Steam Workshop', 'Online PvP', 'Shared/Split Screen PvP', 'Online Co-op', 'Shared/Split Screen Co-op', 'Remote Play on Phone', 'Remote Play on Tablet', 'Remote Play on TV', 'Remote Play Together', 'PvP']","10,000,000 .. 20,000,000",496499,63045,0,0,0,35905,"English, French, Italian, German, Spanish - Spain, Dutch, Portuguese - Portugal, Japanese, Korean, Russian, Turkish, Polish","{'windows': True, 'mac': False, 'linux': False}",2015/07/6,0,http://www.rocketleague.com/,https://cdn.akamai.steamstatic.com/steam/apps/252950/header.jpg?t=1666994460,1.0912087912087916
65,255710,Cities: Skylines,Cities: Skylines is a modern take on the classic city simulation. The game introduces new game play elements to realize the thrill and hardships of creating and maintaining a real city whilst expanding on some well-established tropes of the city building experience.,Colossal Order Ltd.,Paradox Interactive,"Simulation, Strategy","City Builder, Simulation, Building, Management",game,"['Single-player', 'Includes level editor', 'Partial Controller Support', 'Steam Achievements', 'Steam Cloud', 'Steam Trading Cards', 'Steam Workshop', 'Remote Play on Tablet']","5,000,000 .. 10,000,000",194672,13887,2999,2999,0,19325,"English, French, German, Spanish - Spain, Polish, Portuguese - Brazil, Russian, Simplified Chinese, Korean","{'windows': True, 'mac': True, 'linux': True}",2015/03/10,0,,https://cdn.akamai.steamstatic.com/steam/apps/255710/header.jpg?t=1668007889,0.7294117647058823
66,261550,Mount & Blade II: Bannerlord,"A strategy/action RPG. Create a character, engage in diplomacy, craft, trade and conquer new lands in a vast medieval sandbox. Raise armies to lead into battle and command and fight alongside your troops in massive real-time battles using a deep but intuitive skill-based combat system.",TaleWorlds Entertainment,TaleWorlds Entertainment,"Action, Indie, RPG, Simulation, Strategy","Medieval, Strategy, Open World, RPG",game,"['Multi-player', 'Single-player', 'Includes level editor', 'Partial Controller Support', 'Steam Achievements', 'Steam Cloud', 'Steam Trading Cards', 'Steam Workshop', 'Online PvP', 'Remote Play on Tablet', 'PvP']","10,000,000 .. 20,000,000",175612,25381,3999,4999,20,51864,"English, Simplified Chinese, Turkish, Traditional Chinese, French, Italian, Japanese, Korean, Polish, Portuguese - Brazil, Russian, Spanish - Latin America, German","{'windows': True, 'mac': False, 'linux': False}",2022/10/25,0,https://www.taleworlds.com/en/Games/Bannerlord,https://cdn.akamai.steamstatic.com/steam/apps/261550/header.jpg?t=1666722041,0.8666666666666666
67,261640,Borderlands: The Pre-Sequel,Launch into the Borderlands universe and shoot ‘n’ loot your way through a brand new adventure that rockets you onto Pandora’s moon in Borderlands: The Pre-Sequel!,"2K Australia, Gearbox Software, Aspyr (Linux)","2K, Aspyr (Linux)","Action, RPG","Looter Shooter, Co-op, FPS, Action",game,"['Multi-player', 'Single-player', 'Co-op', 'Steam Achievements', 'Steam Cloud', 'Full controller support', 'Steam Trading Cards', 'Remote Play on TV']","2,000,000 .. 5,000,000",30440,7096,3999,3999,0,568,"English, French, Italian, German, Spanish - Spain, Japanese, Russian, Korean","{'windows': True, 'mac': True, 'linux': True}",2014/10/15,15,http://borderlandsthegame.com/,https://cdn.akamai.steamstatic.com/steam/apps/261640/header.jpg?t=1580424842,0.9416666666666668
68,270880,American Truck Simulator,"Experience legendary American trucks and deliver various cargoes across sunny California, sandy Nevada, and the Grand Canyon State of Arizona. American Truck Simulator takes you on a journey through the breathtaking landscapes and widely recognized landmarks around the States.",SCS Software,SCS Software,"Indie, Simulation","Automobile Sim, Driving, Open World, Transportation",game,"['Multi-player', 'Single-player', 'Co-op', 'Includes level editor', 'Partial Controller Support', 'Steam Achievements', 'Steam Cloud', 'Steam Trading Cards', 'Steam Workshop', 'Online Co-op', 'Remote Play Together']","2,000,000 .. 5,000,000",110301,3959,1999,1999,0,8367,"English, French, Italian, German, Spanish - Spain, Bulgarian, Czech, Danish, Dutch, Finnish, Greek, Hungarian, Japanese, Korean, Norwegian, Polish, Portuguese - Portugal, Portuguese - Brazil, Romanian, Russian, Simplified Chinese, Swedish, Turkish, Ukrainian","{'windows': True, 'mac': True, 'linux': True}",2016/02/2,0,https://americantrucksimulator.com/,https://cdn.akamai.steamstatic.com/steam/apps/270880/header.jpg?t=1667652880,1.15625
69,271590,Grand Theft Auto V,"Grand Theft Auto V for PC offers players the option to explore the award-winning world of Los Santos and Blaine County in resolutions of up to 4k and beyond, as well as the chance to experience the game running at 60 frames per second.",Rockstar North,Rockstar Games,"Action, Adventure","Open World, Action, Multiplayer, Crime",game,"['Multi-player', 'Single-player', 'Co-op', 'Steam Achievements', 'Full controller support', 'Online PvP', 'Online Co-op', 'Remote Play on Phone', 'Remote Play on Tablet', 'Remote Play on TV', 'PvP']","20,000,000 .. 50,000,000",1229265,213379,2998,2998,0,140671,"English, French, Italian, German, Spanish - Spain, Korean, Polish, Portuguese - Brazil, Russian, Traditional Chinese, Japanese, Simplified Chinese, Spanish - Latin America","{'windows': True, 'mac': False, 'linux': False}",2015/04/13,0,http://www.rockstargames.com/V/,https://cdn.akamai.steamstatic.com/steam/apps/271590/header.jpg?t=1667343890,1.178923766816144
70,275850,No Man's Sky,No Man's Sky is a game about exploration and survival in an infinite procedurally generated universe.,Hello Games,Hello Games,"Action, Adventure","Open World, Open World Survival Craft, Space, Exploration",game,"['Multi-player', 'Single-player', 'Co-op', 'Steam Achievements', 'Steam Cloud', 'Full controller support', 'Online PvP', 'Online Co-op', 'Remote Play on Tablet', 'Remote Play on TV', 'PvP']","5,000,000 .. 10,000,000",191377,58026,5999,5999,0,11312,"English, French, Italian, German, Spanish - Spain, Dutch, Japanese, Korean, Polish, Portuguese - Portugal, Portuguese - Brazil, Russian, Simplified Chinese, Traditional Chinese","{'windows': True, 'mac': False, 'linux': False}",2016/08/12,0,http://www.no-mans-sky.com,https://cdn.akamai.steamstatic.com/steam/apps/275850/header_alt_assets_14.jpg?t=1665148496,0.8000000000000002
71,284160,BeamNG.drive,A dynamic soft-body physics vehicle simulator capable of doing just about anything.,BeamNG,BeamNG,"Racing, Simulation, Early Access","Simulation, Driving, Physics, Destruction",game,"['Single-player', 'Includes level editor', 'Partial Controller Support', 'Steam Achievements', 'Steam Cloud', 'Steam Trading Cards', 'Remote Play on Phone', 'Remote Play on Tablet', 'Remote Play Together']","2,000,000 .. 5,000,000",140305,4516,2499,2499,0,13455,"English, French, Japanese, Korean, Portuguese - Portugal, Portuguese - Brazil, Russian, Simplified Chinese, Spanish - Latin America, Traditional Chinese, Spanish - Spain","{'windows': True, 'mac': False, 'linux': False}",2015/05/29,0,https://www.beamng.com,https://cdn.akamai.steamstatic.com/steam/apps/284160/header.jpg?t=1666176918,1.3461538461538458
72,286160,Tabletop Simulator,"Tabletop Simulator is the only simulator where you can let your aggression out by flipping the table! There are no rules to follow: just you, a physics sandbox, and your friends. Make your own online board games or play the thousands of community created mods. Unlimited gaming possibilities!",Berserk Games,Berserk Games,"Casual, Indie, RPG, Simulation, Strategy","Tabletop, Board Game, Simulation, Multiplayer",game,"['Multi-player', 'Single-player', 'Co-op', 'Includes level editor', 'Steam Achievements', 'Steam Cloud', 'Shared/Split Screen', 'Cross-Platform Multiplayer', 'Full controller support', 'Steam Trading Cards', 'Steam Workshop', 'Online PvP', 'Shared/Split Screen PvP', 'Online Co-op', 'Shared/Split Screen Co-op', 'Remote Play Together', 'PvP']","2,000,000 .. 5,000,000",52072,3540,1999,1999,0,6421,English,"{'windows': True, 'mac': True, 'linux': True}",2015/06/5,0,https://www.tabletopsimulator.com/,https://cdn.akamai.steamstatic.com/steam/apps/286160/header.jpg?t=1620412025,0.5750000000000001
73,287700,METAL GEAR SOLID V: THE PHANTOM PAIN,"Ushering in a new era for the METAL GEAR franchise with cutting-edge technology powered by the Fox Engine, METAL GEAR SOLID V: The Phantom Pain, will provide players a first-rate gaming experience as they are offered tactical freedom to carry out open-world missions.",Konami Digital Entertainment,Konami Digital Entertainment,"Action, Adventure","Stealth, Open World, Action, Story Rich",game,"['Multi-player', 'Single-player', 'Captions available', 'Steam Achievements', 'Steam Cloud', 'Steam Leaderboards', 'Full controller support', 'Steam Trading Cards', 'In-App Purchases', 'Remote Play on Phone', 'Remote Play on Tablet', 'Remote Play on TV']","2,000,000 .. 5,000,000",72011,7207,1999,1999,0,2149,"English, French, Italian, German, Japanese, Portuguese - Brazil, Russian, Spanish - Latin America","{'windows': True, 'mac': False, 'linux': False}",2015/09/1,18,http://www.metalgearsolid.com,https://cdn.akamai.steamstatic.com/steam/apps/287700/header.jpg?t=1667801931,0.7176470588235294
74,289070,Sid Meier’s Civilization VI,"Civilization VI is the newest installment in the award winning Civilization Franchise. Expand your empire, advance your culture and go head-to-head against history’s greatest leaders. Will your civilization stand the test of time?","Firaxis Games, Aspyr (Mac), Aspyr (Linux)","2K, Aspyr (Mac), Aspyr (Linux)",Strategy,"Strategy, Turn-Based Strategy, Historical, Multiplayer",game,"['Multi-player', 'Single-player', 'Steam Achievements', 'Shared/Split Screen', 'Cross-Platform Multiplayer', 'Steam Trading Cards', 'Steam Workshop', 'Steam Turn Notifications', 'Online PvP', 'Shared/Split Screen PvP', 'Remote Play on Tablet', 'Remote Play Together', 'LAN PvP', 'PvP']","5,000,000 .. 10,000,000",196080,37583,5999,5999,0,43940,"English, French, Italian, German, Spanish - Spain, Japanese, Korean, Polish, Portuguese - Brazil, Russian, Simplified Chinese, Traditional Chinese","{'windows': True, 'mac': True, 'linux': True}",2016/10/20,0,http://www.civilization.com/,https://cdn.akamai.steamstatic.com/steam/apps/289070/header.jpg?t=1663263035,1.1666666666666667
75,291550,Brawlhalla,"An epic platform fighter for up to 8 players online or local. Try casual free-for-alls, ranked matches, or invite friends to a private room. And it's free! Play cross-platform with millions of players on PlayStation, Xbox, Nintendo Switch, iOS, Android &amp; Steam! Frequent updates. Over fifty Legends.",Blue Mammoth Games,Ubisoft,"Action, Free to Play, Indie","Free to Play, Multiplayer, Fighting, Casual",game,"['Multi-player', 'Single-player', 'Co-op', 'Steam Achievements', 'Shared/Split Screen', 'Cross-Platform Multiplayer', 'Full controller support', 'Steam Trading Cards', 'Online PvP', 'Shared/Split Screen PvP', 'Online Co-op', 'Shared/Split Screen Co-op', 'Remote Play on Phone', 'Remote Play on Tablet', 'Remote Play on TV', 'Remote Play Together', 'PvP']","20,000,000 .. 50,000,000",254203,48663,0,0,0,13566,"English, French, Italian, German, Spanish - Spain, Japanese, Korean, Portuguese - Brazil, Russian, Simplified Chinese, Traditional Chinese","{'windows': True, 'mac': True, 'linux': False}",2017/10/17,0,http://www.brawlhalla.com,https://cdn.akamai.steamstatic.com/steam/apps/291550/header.jpg?t=1666282453,0.6424242424242426
76,292030,The Witcher 3: Wild Hunt,"As war rages on throughout the Northern Realms, you take on the greatest contract of your life — tracking down the Child of Prophecy, a living weapon that can alter the shape of the world.",CD PROJEKT RED,CD PROJEKT RED,RPG,"Open World, RPG, Story Rich, Atmospheric",game,"['Single-player', 'Steam Achievements', 'Steam Cloud', 'Full controller support', 'Steam Trading Cards', 'Remote Play on Tablet', 'Remote Play on TV']","10,000,000 .. 20,000,000",632627,25245,3999,3999,0,22812,"English, French, Italian, German, Spanish - Spain, Arabic, Czech, Hungarian, Japanese, Korean, Polish, Portuguese - Brazil, Russian, Traditional Chinese, Turkish, Simplified Chinese","{'windows': True, 'mac': False, 'linux': False}",2015/05/18,0,http://www.thewitcher.com,https://cdn.akamai.steamstatic.com/steam/apps/292030/header.jpg?t=1659619680,0.9504761904761905
77,304050,Trove,"Grab your friends, hone your blades, and set off for adventure in Trove, the ultimate action MMO!",gamigo US Inc.,gamigo US Inc.,"Action, Adventure, Casual, Free to Play, Massively Multiplayer, RPG","Free to Play, Open World, Multiplayer, MMORPG",game,"['Multi-player', 'Co-op', 'Partial Controller Support', 'MMO', 'Steam Achievements', 'Steam Trading Cards', 'Steam Workshop', 'In-App Purchases', 'Online PvP', 'PvP']","10,000,000 .. 20,000,000",71138,17072,0,0,0,1552,"English, French, German, Portuguese - Brazil, Spanish - Spain","{'windows': True, 'mac': False, 'linux': False}",2015/07/9,0,http://www.trionworlds.com/trove/?affiliateId=steamtrove,https://cdn.akamai.steamstatic.com/steam/apps/304050/header.jpg?t=1665388424,0.55
78,304390,FOR HONOR,"Carve a path of destruction through an intense, believable battlefield in For Honor.","Ubisoft Montreal, Ubisoft Quebec, Ubisoft Toronto, Blue Byte",Ubisoft,Action,"Medieval, Swordplay, Action, Multiplayer",game,"['Multi-player', 'Single-player', 'Co-op', 'Partial Controller Support', 'Steam Trading Cards', 'In-App Purchases', 'Online PvP', 'Online Co-op', 'PvP']","2,000,000 .. 5,000,000",84062,38370,1499,1499,0,3249,"English, French, Italian, German, Spanish - Spain, Dutch, Japanese, Korean, Polish, Portuguese - Brazil, Russian, Simplified Chinese, Traditional Chinese, Czech","{'windows': True, 'mac': False, 'linux': False}",2017/02/13,0,http://forhonorgame.com/,https://cdn.akamai.steamstatic.com/steam/apps/304390/header.jpg?t=1666271501,0.4428571428571428
79,304930,Unturned,"You're a survivor in the zombie infested ruins of society, and must work with your friends and forge alliances to remain among the living.",Smartly Dressed Games,Smartly Dressed Games,"Action, Adventure, Casual, Free to Play, Indie","Free to Play, Survival, Zombies, Multiplayer",game,"['Multi-player', 'Single-player', 'Valve Anti-Cheat enabled', 'Co-op', 'Stats', 'Includes level editor', 'Steam Achievements', 'Steam Cloud', 'Steam Trading Cards', 'Steam Workshop', 'In-App Purchases', 'Online PvP', 'Online Co-op', 'Remote Play on Tablet', 'LAN PvP', 'LAN Co-op', 'PvP']","20,000,000 .. 50,000,000",451671,42098,0,0,0,59366,English,"{'windows': True, 'mac': True, 'linux': True}",2017/07/7,0,http://smartlydressedgames.com/,https://cdn.akamai.steamstatic.com/steam/apps/304930/header.jpg?t=1666823591,0.8750000000000001
80,306130,The Elder Scrolls Online,"Join over 20 million players in the award-winning online multiplayer RPG and experience limitless adventure in a persistent Elder Scrolls world. Battle, craft, steal, or explore, and combine different types of equipment and abilities to create your own style of play. No game subscription required.",ZeniMax Online Studios,Bethesda Softworks,"Action, Adventure, Massively Multiplayer, RPG","RPG, MMORPG, Adventure, Open World",game,"['Multi-player', 'Co-op', 'Captions available', 'Partial Controller Support', 'MMO', 'Steam Trading Cards', 'In-App Purchases', 'Online PvP', 'Online Co-op', 'PvP']","5,000,000 .. 10,000,000",102825,22879,1999,1999,0,19200,"English, French, German, Russian, Spanish - Spain, Simplified Chinese","{'windows': True, 'mac': True, 'linux': False}",2017/05/22,0,http://www.elderscrollsonline.com,https://cdn.akamai.steamstatic.com/steam/apps/306130/header_alt_assets_8.jpg?t=1667312669,1.5227272727272727
81,311210,Call of Duty: Black Ops III,Call of Duty®: Black Ops III Zombies Chronicles Edition includes the full base game plus the Zombies Chronicles content expansion.,"Treyarch, Aspyr (Mac)","Activision, Aspyr (Mac)","Action, Adventure","Multiplayer, FPS, Zombies, Shooter",game,"['Multi-player', 'Single-player', 'Valve Anti-Cheat enabled', 'Co-op', 'Steam Achievements', 'Shared/Split Screen', 'Steam Leaderboards', 'Full controller support', 'Steam Trading Cards', 'Steam Workshop', 'Remote Play on Phone', 'Remote Play on Tablet', 'Remote Play on TV', 'Remote Play Together']","5,000,000 .. 10,000,000",119998,28202,5999,5999,0,3963,"English, French, Italian, German, Spanish - Spain, Simplified Chinese, Traditional Chinese, Japanese, Polish, Portuguese - Brazil, Russian","{'windows': True, 'mac': True, 'linux': False}",2015/11/5,18,https://www.callofduty.com/blackops3,https://cdn.akamai.steamstatic.com/steam/apps/311210/header.jpg?t=1646763462,0.593939393939394
